{
  "version": "0.1.0",
  "metadata": {
    "created": "2025-01-10T12:00:00Z",
    "updated": "2025-01-10T12:00:00Z",
    "owner": "automation-lover@example.com"
  },
  "preferences": {
    "ui": {
      "theme": "auto",
      "density": "comfortable",
      "fontSize": "medium"
    },
    "interaction": {
      "tone": "casual",
      "verbosity": "moderate",
      "confirmationStyle": "destructive-only"
    },
    "automation": {
      "level": "aggressive",
      "aiSuggestions": true,
      "autoSave": true,
      "predictiveActions": true,
      "maxAutomationScope": "global"
    },
    "notifications": {
      "enabled": true,
      "frequency": "batched",
      "channels": ["in-app", "email"]
    }
  },
  "behaviors": {
    "workflow": "task-focused",
    "learningStyle": "examples",
    "decisionSpeed": "quick"
  }
}

